{
  "$schema": "./trace-model-routing-result.schema.json", "schemaVersion": 1, "policy": "terra-sol", "caseId": "s2-cnz-shared-sidekick-control", "baseCommit": "7fe4b63fa7f411515fe20c8dd5d1b5f9321d2b7f", "resultTree": "0000000000000000000000000000000000000000", "patch": {"path": "target/trace-model-routing/terra-sol/s2-cnz-shared-sidekick-control.patch", "sha256": "0000000000000000000000000000000000000000000000000000000000000000"},
  "stages": [
    {"name": "triage", "requestedModel": "gpt-5.6-terra", "requestedEffort": "medium", "actualModel": null, "actualEffort": null, "complexity": "shared", "confidence": "high", "beforeFrame": 202, "afterFrame": 202, "status": "completed", "attemptCount": 0, "regressionCount": 0, "sharedSurfaces": ["SidekickCpuController"], "needsEscalation": false, "escalationReasons": [], "modelRoute": ["gpt-5.6-terra/medium"], "usage": {"inputTokens": null, "cachedInputTokens": null, "outputTokens": null, "reasoningTokens": null}, "durationMs": null},
    {"name": "fix", "requestedModel": "gpt-5.6-sol", "requestedEffort": "high", "actualModel": null, "actualEffort": null, "complexity": "shared", "confidence": "high", "beforeFrame": 202, "afterFrame": 3675, "status": "advanced", "attemptCount": 1, "regressionCount": 0, "sharedSurfaces": ["SidekickCpuController"], "needsEscalation": false, "escalationReasons": [], "modelRoute": ["gpt-5.6-sol/high"], "usage": {"inputTokens": null, "cachedInputTokens": null, "outputTokens": null, "reasoningTokens": null}, "durationMs": null},
    {"name": "verify", "requestedModel": "gpt-5.6-sol", "requestedEffort": "high", "actualModel": null, "actualEffort": null, "complexity": "shared", "confidence": "high", "beforeFrame": 3675, "afterFrame": 3675, "status": "advanced", "attemptCount": 1, "regressionCount": 0, "sharedSurfaces": ["SidekickCpuController"], "needsEscalation": false, "escalationReasons": [], "modelRoute": ["gpt-5.6-sol/high"], "usage": {"inputTokens": null, "cachedInputTokens": null, "outputTokens": null, "reasoningTokens": null}, "durationMs": null}
  ],
  "tokens": {"inputTokens": null, "cachedInputTokens": null, "outputTokens": null, "reasoningTokens": null}, "wallTimeMs": null, "totalAttemptCount": 2, "beforeFrontier": {"frame": 202, "field": "tails_x"}, "afterFrontier": {"frame": 3675, "field": "tails_cpu_ctrl2_held"}, "status": "advanced", "citations": ["git:12c3a4d46e9537127ddc5ad342d755c0c3fa6ab5", "docs/TRACE_FRONTIER_LOG.md"], "regressions": []
}
